{"createdAt":"2026-08-29T00:20:00.000Z","files":[{"bytes":269,"path":"WORLD_BIBLE.md","sha256":"66402903c2d4f7ebdfec5e4bc517905a975e1702265953a1da1e9f6d6c19aedc"}],"headReceiptSha256":"6171e11865966a258e0bb79b4ecf0a9eab01d4c013d2245e320f80454b32136c","projectRef":"project-pseudonym-001","releaseId":"release-001","rightsBasis":"original_ip","schemaVersion":"1.0.0","sourceCommit":"7777777777777777777777777777777777777777"}
